{
  "title": "مجسم الهرم الذهبي المدرج (Golden Pyramid)",
  "generator": "Voxel Island 3D Studio",
  "version": "3.5",
  "gridSize": 8,
  "centerOffset": {
    "x": 0,
    "y": 0,
    "z": 0
  },
  "layers": [
    {
      "id": 1,
      "name": "طبقة 1: المستوى 1 (Y=1)",
      "y": 1,
      "grid": [
        [
          "#b45309",
          "#b45309",
          "#b45309",
          "#b45309",
          "#b45309",
          "#b45309",
          "#b45309",
          "#b45309"
        ],
        [
          "#b45309",
          "#b45309",
          "#b45309",
          "#b45309",
          "#b45309",
          "#b45309",
          "#b45309",
          "#b45309"
        ],
        [
          "#b45309",
          "#b45309",
          "#b45309",
          "#b45309",
          "#b45309",
          "#b45309",
          "#b45309",
          "#b45309"
        ],
        [
          "#b45309",
          "#b45309",
          "#b45309",
          "#b45309",
          "#b45309",
          "#b45309",
          "#b45309",
          "#b45309"
        ],
        [
          "#b45309",
          "#b45309",
          "#b45309",
          "#b45309",
          "#b45309",
          "#b45309",
          "#b45309",
          "#b45309"
        ],
        [
          "#b45309",
          "#b45309",
          "#b45309",
          "#b45309",
          "#b45309",
          "#b45309",
          "#b45309",
          "#b45309"
        ],
        [
          "#b45309",
          "#b45309",
          "#b45309",
          "#b45309",
          "#b45309",
          "#b45309",
          "#b45309",
          "#b45309"
        ],
        [
          "#b45309",
          "#b45309",
          "#b45309",
          "#b45309",
          "#b45309",
          "#b45309",
          "#b45309",
          "#b45309"
        ]
      ]
    },
    {
      "id": 2,
      "name": "طبقة 2: المستوى 2 (Y=2)",
      "y": 2,
      "grid": [
        [
          null,
          null,
          null,
          null,
          null,
          null,
          null,
          null
        ],
        [
          null,
          "#d97706",
          "#d97706",
          "#d97706",
          "#d97706",
          "#d97706",
          "#d97706",
          null
        ],
        [
          null,
          "#d97706",
          "#d97706",
          "#d97706",
          "#d97706",
          "#d97706",
          "#d97706",
          null
        ],
        [
          null,
          "#d97706",
          "#d97706",
          "#d97706",
          "#d97706",
          "#d97706",
          "#d97706",
          null
        ],
        [
          null,
          "#d97706",
          "#d97706",
          "#d97706",
          "#d97706",
          "#d97706",
          "#d97706",
          null
        ],
        [
          null,
          "#d97706",
          "#d97706",
          "#d97706",
          "#d97706",
          "#d97706",
          "#d97706",
          null
        ],
        [
          null,
          "#d97706",
          "#d97706",
          "#d97706",
          "#d97706",
          "#d97706",
          "#d97706",
          null
        ],
        [
          null,
          null,
          null,
          null,
          null,
          null,
          null,
          null
        ]
      ]
    },
    {
      "id": 3,
      "name": "طبقة 3: المستوى 3 (Y=3)",
      "y": 3,
      "grid": [
        [
          null,
          null,
          null,
          null,
          null,
          null,
          null,
          null
        ],
        [
          null,
          null,
          null,
          null,
          null,
          null,
          null,
          null
        ],
        [
          null,
          null,
          "#f59e0b",
          "#f59e0b",
          "#f59e0b",
          "#f59e0b",
          null,
          null
        ],
        [
          null,
          null,
          "#f59e0b",
          "#f59e0b",
          "#f59e0b",
          "#f59e0b",
          null,
          null
        ],
        [
          null,
          null,
          "#f59e0b",
          "#f59e0b",
          "#f59e0b",
          "#f59e0b",
          null,
          null
        ],
        [
          null,
          null,
          "#f59e0b",
          "#f59e0b",
          "#f59e0b",
          "#f59e0b",
          null,
          null
        ],
        [
          null,
          null,
          null,
          null,
          null,
          null,
          null,
          null
        ],
        [
          null,
          null,
          null,
          null,
          null,
          null,
          null,
          null
        ]
      ]
    },
    {
      "id": 4,
      "name": "طبقة 4: المستوى 4 (Y=4)",
      "y": 4,
      "grid": [
        [
          null,
          null,
          null,
          null,
          null,
          null,
          null,
          null
        ],
        [
          null,
          null,
          null,
          null,
          null,
          null,
          null,
          null
        ],
        [
          null,
          null,
          null,
          null,
          null,
          null,
          null,
          null
        ],
        [
          null,
          null,
          null,
          "#fef08a",
          "#fef08a",
          null,
          null,
          null
        ],
        [
          null,
          null,
          null,
          "#fef08a",
          "#fef08a",
          null,
          null,
          null
        ],
        [
          null,
          null,
          null,
          null,
          null,
          null,
          null,
          null
        ],
        [
          null,
          null,
          null,
          null,
          null,
          null,
          null,
          null
        ],
        [
          null,
          null,
          null,
          null,
          null,
          null,
          null,
          null
        ]
      ]
    }
  ]
}