{
  "title": "فنجان قهوة وبخار دافئ (Coffee Mug)",
  "generator": "Voxel Island 3D Studio - Generator",
  "version": "3.5",
  "gridSize": 8,
  "centerOffset": {
    "x": 0,
    "y": 0,
    "z": 0
  },
  "layers": [
    {
      "id": 1,
      "name": "طبقة 1: صحن الفنجان",
      "y": 1,
      "grid": [
        [
          null,
          null,
          null,
          null,
          null,
          null,
          null,
          null
        ],
        [
          null,
          "#ffffff",
          "#ffffff",
          "#ffffff",
          "#ffffff",
          "#ffffff",
          "#ffffff",
          null
        ],
        [
          null,
          "#ffffff",
          "#ffffff",
          "#ffffff",
          "#ffffff",
          "#ffffff",
          "#ffffff",
          null
        ],
        [
          null,
          "#ffffff",
          "#ffffff",
          "#ffffff",
          "#ffffff",
          "#ffffff",
          "#ffffff",
          null
        ],
        [
          null,
          "#ffffff",
          "#ffffff",
          "#ffffff",
          "#ffffff",
          "#ffffff",
          "#ffffff",
          null
        ],
        [
          null,
          "#ffffff",
          "#ffffff",
          "#ffffff",
          "#ffffff",
          "#ffffff",
          "#ffffff",
          null
        ],
        [
          null,
          "#ffffff",
          "#ffffff",
          "#ffffff",
          "#ffffff",
          "#ffffff",
          "#ffffff",
          null
        ],
        [
          null,
          null,
          null,
          null,
          null,
          null,
          null,
          null
        ]
      ]
    },
    {
      "id": 2,
      "name": "طبقة 2: قاعدة الفنجان",
      "y": 2,
      "grid": [
        [
          null,
          null,
          null,
          null,
          null,
          null,
          null,
          null
        ],
        [
          null,
          null,
          null,
          null,
          null,
          null,
          null,
          null
        ],
        [
          null,
          null,
          "#18181b",
          "#18181b",
          "#18181b",
          "#18181b",
          null,
          null
        ],
        [
          null,
          null,
          "#18181b",
          "#18181b",
          "#18181b",
          "#18181b",
          null,
          null
        ],
        [
          null,
          null,
          "#18181b",
          "#18181b",
          "#18181b",
          "#18181b",
          null,
          null
        ],
        [
          null,
          null,
          "#18181b",
          "#18181b",
          "#18181b",
          "#18181b",
          null,
          null
        ],
        [
          null,
          null,
          null,
          null,
          null,
          null,
          null,
          null
        ],
        [
          null,
          null,
          null,
          null,
          null,
          null,
          null,
          null
        ]
      ]
    },
    {
      "id": 3,
      "name": "طبقة 3: القهوة والمقبض",
      "y": 3,
      "grid": [
        [
          null,
          null,
          null,
          null,
          null,
          null,
          null,
          null
        ],
        [
          null,
          null,
          null,
          null,
          null,
          null,
          null,
          null
        ],
        [
          null,
          null,
          "#18181b",
          "#18181b",
          "#18181b",
          "#18181b",
          null,
          null
        ],
        [
          null,
          null,
          "#18181b",
          "#78350f",
          "#78350f",
          "#18181b",
          "#18181b",
          null
        ],
        [
          null,
          null,
          "#18181b",
          "#78350f",
          "#78350f",
          "#18181b",
          "#18181b",
          null
        ],
        [
          null,
          null,
          "#18181b",
          "#18181b",
          "#18181b",
          "#18181b",
          null,
          null
        ],
        [
          null,
          null,
          null,
          null,
          null,
          null,
          null,
          null
        ],
        [
          null,
          null,
          null,
          null,
          null,
          null,
          null,
          null
        ]
      ]
    },
    {
      "id": 4,
      "name": "طبقة 4: رغوة الكابتشينو",
      "y": 4,
      "grid": [
        [
          null,
          null,
          null,
          null,
          null,
          null,
          null,
          null
        ],
        [
          null,
          null,
          null,
          null,
          null,
          null,
          null,
          null
        ],
        [
          null,
          null,
          "#ffffff",
          "#ffffff",
          "#ffffff",
          "#ffffff",
          null,
          null
        ],
        [
          null,
          null,
          "#ffffff",
          "#fef3c7",
          "#fef3c7",
          "#ffffff",
          null,
          null
        ],
        [
          null,
          null,
          "#ffffff",
          "#fef3c7",
          "#fef3c7",
          "#ffffff",
          null,
          null
        ],
        [
          null,
          null,
          "#ffffff",
          "#ffffff",
          "#ffffff",
          "#ffffff",
          null,
          null
        ],
        [
          null,
          null,
          null,
          null,
          null,
          null,
          null,
          null
        ],
        [
          null,
          null,
          null,
          null,
          null,
          null,
          null,
          null
        ]
      ]
    },
    {
      "id": 5,
      "name": "طبقة 5: بخار القهوة الساخن",
      "y": 5,
      "grid": [
        [
          null,
          null,
          null,
          null,
          null,
          null,
          null,
          null
        ],
        [
          null,
          null,
          null,
          null,
          null,
          null,
          null,
          null
        ],
        [
          null,
          null,
          null,
          null,
          null,
          null,
          null,
          null
        ],
        [
          null,
          null,
          null,
          "#e4e4e7",
          null,
          null,
          null,
          null
        ],
        [
          null,
          null,
          null,
          null,
          "#e4e4e7",
          null,
          null,
          null
        ],
        [
          null,
          null,
          null,
          null,
          null,
          null,
          null,
          null
        ],
        [
          null,
          null,
          null,
          null,
          null,
          null,
          null,
          null
        ],
        [
          null,
          null,
          null,
          null,
          null,
          null,
          null,
          null
        ]
      ]
    },
    {
      "id": 6,
      "name": "طبقة 6: قمة البخار",
      "y": 6,
      "grid": [
        [
          null,
          null,
          null,
          null,
          null,
          null,
          null,
          null
        ],
        [
          null,
          null,
          null,
          null,
          null,
          null,
          null,
          null
        ],
        [
          null,
          null,
          null,
          null,
          null,
          null,
          null,
          null
        ],
        [
          null,
          null,
          null,
          null,
          "#d4d4d8",
          null,
          null,
          null
        ],
        [
          null,
          null,
          null,
          null,
          null,
          null,
          null,
          null
        ],
        [
          null,
          null,
          null,
          null,
          null,
          null,
          null,
          null
        ],
        [
          null,
          null,
          null,
          null,
          null,
          null,
          null,
          null
        ],
        [
          null,
          null,
          null,
          null,
          null,
          null,
          null,
          null
        ]
      ]
    }
  ]
}