{
  "title": "مجسم قلب ياقوتي أحمر (Ruby Heart 3D)",
  "generator": "Voxel Island 3D Studio",
  "version": "3.5",
  "gridSize": 8,
  "centerOffset": {
    "x": 0,
    "y": 1,
    "z": 0
  },
  "layers": [
    {
      "id": 3,
      "name": "طبقة 0 (Y=3)",
      "y": 3,
      "grid": [
        [
          null,
          null,
          null,
          null,
          null,
          null,
          null,
          null
        ],
        [
          null,
          null,
          null,
          null,
          null,
          null,
          null,
          null
        ],
        [
          null,
          null,
          "#db2777",
          "#db2777",
          "#db2777",
          "#db2777",
          null,
          null
        ],
        [
          null,
          null,
          "#db2777",
          "#db2777",
          "#db2777",
          "#db2777",
          null,
          null
        ],
        [
          null,
          null,
          "#db2777",
          "#db2777",
          "#db2777",
          "#db2777",
          null,
          null
        ],
        [
          null,
          null,
          null,
          "#db2777",
          "#db2777",
          null,
          null,
          null
        ],
        [
          null,
          null,
          null,
          null,
          null,
          null,
          null,
          null
        ],
        [
          null,
          null,
          null,
          null,
          null,
          null,
          null,
          null
        ]
      ]
    },
    {
      "id": 4,
      "name": "طبقة 1 (Y=4)",
      "y": 4,
      "grid": [
        [
          null,
          null,
          null,
          null,
          null,
          null,
          null,
          null
        ],
        [
          null,
          null,
          "#e11d48",
          "#e11d48",
          "#e11d48",
          "#e11d48",
          null,
          null
        ],
        [
          null,
          "#e11d48",
          "#e11d48",
          "#e11d48",
          "#e11d48",
          "#e11d48",
          "#e11d48",
          null
        ],
        [
          null,
          "#e11d48",
          "#e11d48",
          "#e11d48",
          "#e11d48",
          "#e11d48",
          "#e11d48",
          null
        ],
        [
          null,
          "#e11d48",
          "#e11d48",
          "#e11d48",
          "#e11d48",
          "#e11d48",
          "#e11d48",
          null
        ],
        [
          null,
          null,
          null,
          "#e11d48",
          "#e11d48",
          null,
          null,
          null
        ],
        [
          null,
          null,
          null,
          null,
          null,
          null,
          null,
          null
        ],
        [
          null,
          null,
          null,
          null,
          null,
          null,
          null,
          null
        ]
      ]
    },
    {
      "id": 5,
      "name": "طبقة 2 (Y=5)",
      "y": 5,
      "grid": [
        [
          null,
          null,
          null,
          null,
          null,
          null,
          null,
          null
        ],
        [
          null,
          null,
          null,
          null,
          null,
          null,
          null,
          null
        ],
        [
          null,
          null,
          "#f472b6",
          "#f472b6",
          "#f472b6",
          "#f472b6",
          null,
          null
        ],
        [
          null,
          null,
          "#f472b6",
          "#f472b6",
          "#f472b6",
          "#f472b6",
          null,
          null
        ],
        [
          null,
          null,
          "#f472b6",
          "#f472b6",
          "#f472b6",
          "#f472b6",
          null,
          null
        ],
        [
          null,
          null,
          null,
          "#f472b6",
          "#f472b6",
          null,
          null,
          null
        ],
        [
          null,
          null,
          null,
          null,
          null,
          null,
          null,
          null
        ],
        [
          null,
          null,
          null,
          null,
          null,
          null,
          null,
          null
        ]
      ]
    }
  ]
}