{
  "title": "هرم ذهبي مدرج (Golden Stepped Pyramid)",
  "generator": "Voxel Island 3D Studio - Generator",
  "version": "3.5",
  "gridSize": 8,
  "centerOffset": {
    "x": 0,
    "y": 0,
    "z": 0
  },
  "layers": [
    {
      "id": 1,
      "name": "طبقة 1 (Y=1)",
      "y": 1,
      "grid": [
        [
          "#d97706",
          "#d97706",
          "#d97706",
          "#d97706",
          "#d97706",
          "#d97706",
          "#d97706",
          "#d97706"
        ],
        [
          "#d97706",
          "#f59e0b",
          "#f59e0b",
          "#f59e0b",
          "#f59e0b",
          "#f59e0b",
          "#f59e0b",
          "#d97706"
        ],
        [
          "#d97706",
          "#f59e0b",
          "#f59e0b",
          "#f59e0b",
          "#f59e0b",
          "#f59e0b",
          "#f59e0b",
          "#d97706"
        ],
        [
          "#d97706",
          "#f59e0b",
          "#f59e0b",
          "#f59e0b",
          "#f59e0b",
          "#f59e0b",
          "#f59e0b",
          "#d97706"
        ],
        [
          "#d97706",
          "#f59e0b",
          "#f59e0b",
          "#f59e0b",
          "#f59e0b",
          "#f59e0b",
          "#f59e0b",
          "#d97706"
        ],
        [
          "#d97706",
          "#f59e0b",
          "#f59e0b",
          "#f59e0b",
          "#f59e0b",
          "#f59e0b",
          "#f59e0b",
          "#d97706"
        ],
        [
          "#d97706",
          "#f59e0b",
          "#f59e0b",
          "#f59e0b",
          "#f59e0b",
          "#f59e0b",
          "#f59e0b",
          "#d97706"
        ],
        [
          "#d97706",
          "#d97706",
          "#d97706",
          "#d97706",
          "#d97706",
          "#d97706",
          "#d97706",
          "#d97706"
        ]
      ]
    },
    {
      "id": 2,
      "name": "طبقة 2 (Y=2)",
      "y": 2,
      "grid": [
        [
          null,
          null,
          null,
          null,
          null,
          null,
          null,
          null
        ],
        [
          null,
          "#d97706",
          "#d97706",
          "#d97706",
          "#d97706",
          "#d97706",
          "#d97706",
          null
        ],
        [
          null,
          "#d97706",
          "#f59e0b",
          "#f59e0b",
          "#f59e0b",
          "#f59e0b",
          "#d97706",
          null
        ],
        [
          null,
          "#d97706",
          "#f59e0b",
          "#f59e0b",
          "#f59e0b",
          "#f59e0b",
          "#d97706",
          null
        ],
        [
          null,
          "#d97706",
          "#f59e0b",
          "#f59e0b",
          "#f59e0b",
          "#f59e0b",
          "#d97706",
          null
        ],
        [
          null,
          "#d97706",
          "#f59e0b",
          "#f59e0b",
          "#f59e0b",
          "#f59e0b",
          "#d97706",
          null
        ],
        [
          null,
          "#d97706",
          "#d97706",
          "#d97706",
          "#d97706",
          "#d97706",
          "#d97706",
          null
        ],
        [
          null,
          null,
          null,
          null,
          null,
          null,
          null,
          null
        ]
      ]
    },
    {
      "id": 3,
      "name": "طبقة 3 (Y=3)",
      "y": 3,
      "grid": [
        [
          null,
          null,
          null,
          null,
          null,
          null,
          null,
          null
        ],
        [
          null,
          null,
          null,
          null,
          null,
          null,
          null,
          null
        ],
        [
          null,
          null,
          "#d97706",
          "#d97706",
          "#d97706",
          "#d97706",
          null,
          null
        ],
        [
          null,
          null,
          "#d97706",
          "#f59e0b",
          "#f59e0b",
          "#d97706",
          null,
          null
        ],
        [
          null,
          null,
          "#d97706",
          "#f59e0b",
          "#f59e0b",
          "#d97706",
          null,
          null
        ],
        [
          null,
          null,
          "#d97706",
          "#d97706",
          "#d97706",
          "#d97706",
          null,
          null
        ],
        [
          null,
          null,
          null,
          null,
          null,
          null,
          null,
          null
        ],
        [
          null,
          null,
          null,
          null,
          null,
          null,
          null,
          null
        ]
      ]
    },
    {
      "id": 4,
      "name": "طبقة 4 (Y=4)",
      "y": 4,
      "grid": [
        [
          null,
          null,
          null,
          null,
          null,
          null,
          null,
          null
        ],
        [
          null,
          null,
          null,
          null,
          null,
          null,
          null,
          null
        ],
        [
          null,
          null,
          null,
          null,
          null,
          null,
          null,
          null
        ],
        [
          null,
          null,
          null,
          "#d97706",
          "#d97706",
          null,
          null,
          null
        ],
        [
          null,
          null,
          null,
          "#d97706",
          "#d97706",
          null,
          null,
          null
        ],
        [
          null,
          null,
          null,
          null,
          null,
          null,
          null,
          null
        ],
        [
          null,
          null,
          null,
          null,
          null,
          null,
          null,
          null
        ],
        [
          null,
          null,
          null,
          null,
          null,
          null,
          null,
          null
        ]
      ]
    },
    {
      "id": 5,
      "name": "طبقة 5 (Y=5)",
      "y": 5,
      "grid": [
        [
          null,
          null,
          null,
          null,
          null,
          null,
          null,
          null
        ],
        [
          null,
          null,
          null,
          null,
          null,
          null,
          null,
          null
        ],
        [
          null,
          null,
          null,
          null,
          null,
          null,
          null,
          null
        ],
        [
          null,
          null,
          null,
          null,
          null,
          null,
          null,
          null
        ],
        [
          null,
          null,
          null,
          null,
          null,
          null,
          null,
          null
        ],
        [
          null,
          null,
          null,
          null,
          null,
          null,
          null,
          null
        ],
        [
          null,
          null,
          null,
          null,
          null,
          null,
          null,
          null
        ],
        [
          null,
          null,
          null,
          null,
          null,
          null,
          null,
          null
        ]
      ]
    }
  ]
}